{
  "evidence_id": "evid_alpha_002",
  "evidence_type": "interview_statement",
  "source_type": "stakeholder",
  "collection_method": "interview",
  "collected_at": "2026-06-18T10:05:00Z",
  "collected_by": "consultant_a",
  "related_object_ids": ["intake_alpha_2026", "intv_alpha_wh_lead"],
  "summary": "Warehouse lead reported that physical cycle counts 'almost always' disagree with the ERP, and that discrepancies are resolved by manually adjusting the ERP to match the count without root-cause review.",
  "reliability": "medium",
  "confidence_notes": "First-hand account from the person performing counts; not yet corroborated against count records.",
  "access_notes": "Verbal statement captured in interview notes; no recording retained.",
  "retention_notes": "Interview notes held by consultant; formal retention policy to be defined in a later phase.",
  "sensitive_data_flag": false,
  "consultant_notes": "Corroborate against the last cycle-count report and the adjustment log once ERP access is granted."
}
